{
  "version": "2025-09-25",
  "title": "BOMS ランディング",
  "description": "GitHub Pages で提供されるランディングコンテンツ (JA)",
  "sections": [
    { "type": "hero", "headline": "こんにちは、BOMS です", "sub": "最新情報と機能をお届けします", "image": "/assets/hero.jpg", "cta": { "label": "詳しく見る", "href": "#" } },
    { "type": "feature", "items": [
      { "icon": "⚡", "title": "素早い反映", "desc": "JSON 変更後すぐにデプロイ" },
      { "icon": "🔒", "title": "安定運用", "desc": "PR レビューでエラーを防止" },
      { "icon": "🧩", "title": "柔軟な構造", "desc": "緩いスキーマで拡張しやすい" }
    ]}
  ]
}

