{
  "version": "2025-09-25",
  "title": "BOMS Landing",
  "description": "Landing-Inhalte Ã¼ber GitHub Pages bereitgestellt (DE)",
  "sections": [
    { "type": "hero", "headline": "Hallo von BOMS", "sub": "Neuigkeiten und Funktionen", "image": "/assets/hero.jpg", "cta": { "label": "Mehr erfahren", "href": "#" } },
    { "type": "feature", "items": [
      { "icon": "âš¡", "title": "Schnelle Updates", "desc": "Schnell deployen nach JSON-Ã„nderungen" },
      { "icon": "ðŸ”’", "title": "Stabiler Betrieb", "desc": "FehlerprÃ¤vention durch PR-Review" },
      { "icon": "ðŸ§©", "title": "Flexibel", "desc": "Lockeres Schema, leicht erweiterbar" }
    ]}
  ]
}

