{
  "version": "2025-09-25",
  "title": "BOMS Landing",
  "description": "Contenido de aterrizaje servido por GitHub Pages (ES)",
  "sections": [
    { "type": "hero", "headline": "Hola desde BOMS", "sub": "Compartimos novedades y funciones", "image": "/assets/hero.jpg", "cta": { "label": "Saber mÃ¡s", "href": "#" } },
    { "type": "feature", "items": [
      { "icon": "âš¡", "title": "Actualizaciones rÃ¡pidas", "desc": "Despliegue inmediato tras cambios en JSON" },
      { "icon": "ğŸ”’", "title": "OperaciÃ³n segura", "desc": "Evita errores con revisiÃ³n de PR" },
      { "icon": "ğŸ§©", "title": "Flexible", "desc": "Esquema ligero, fÃ¡cil de extender" }
    ]}
  ]
}

