{
  "version": "2025-09-25",
  "title": "BOMS Landing",
  "description": "Contenu de landing servi via GitHub Pages (FR)",
  "sections": [
    { "type": "hero", "headline": "Bonjour de BOMS", "sub": "Derni√®res nouvelles et fonctionnalit√©s", "image": "/assets/hero.jpg", "cta": { "label": "En savoir plus", "href": "#" } },
    { "type": "feature", "items": [
      { "icon": "‚ö°", "title": "Mises √† jour rapides", "desc": "D√©ploiement rapide apr√®s changements JSON" },
      { "icon": "üîí", "title": "Exploitation fiable", "desc": "Pr√©venir les erreurs avec revue de PR" },
      { "icon": "üß©", "title": "Flexible", "desc": "Sch√©ma l√©ger, facile √† √©tendre" }
    ]}
  ]
}

